State,City,Header,Description,Link
Colorado,Denver,OneNeck Denver,OneNeck IT Solutions8675 Concord Center Dr80112 Englewood,/usa/colorado/denver/oneneck-it-solutions/
Colorado,Denver,EdgeConneX Denver - EDCDEN01,EdgeConneX8535 Highfield Pkwy80112 Englewood,/usa/colorado/denver/edcden01/
Colorado,Denver,CoreSite Denver (DE1),CoreSite910 15th st80202 Denver,/usa/colorado/denver/coresite-de1/
Colorado,Denver,QTS Aurora-Denver Campus,QTS Data Centers1160 N. Gun Club Rd80018 Aurora,/usa/colorado/denver/qts-auroradenver-campus/
Colorado,Denver,DataBank DEN5 - Centennial II,DataBank6961 S Quentin St80112 Centennial,/usa/colorado/denver/databank-den5-centennial-ii/
Colorado,Denver,CoreSite Denver (DE2),CoreSite639 E 18th Ave80203 Denver,/usa/colorado/denver/coresite-denver-de2/
Colorado,Denver,DataBank DEN1 - Englewood,DataBank393 Inverness Parkway80112 Englewood,/usa/colorado/denver/latisys-denver/
Colorado,Denver,1500 Champa,Morgan Reed Group1500 Champa Street80202 Denver,/usa/colorado/denver/1500-champa/
Colorado,Denver,Centersquare - Denver DEN1-A,Centersquare9180 Commerce Center Cir80129 Highland Ranch,/usa/colorado/denver/cyxtera-den1/
Colorado,Denver,DataBank DEN2 - Centennial,DataBank6900 S. Peoria Street80112 Centennial,/usa/colorado/denver/latisys-den2/
Colorado,Denver,DataBank DEN4 - Westminister,DataBank7579 W. 103rd Avenue80021 Westminster,/usa/colorado/denver/databank-den4/
Colorado,Denver,DataBank DEN3 - Downtown Denver,DataBank1500 Champa Street80202 Denver,/usa/colorado/denver/databank-den3/
Colorado,Denver,365 Data Centers - SungardAS Aurora,365 Data Centers3431 N. Windsor Dr80011 Aurora,/usa/colorado/denver/sungardas-aurora/
Colorado,Denver,Centersquare - Denver DEN2,Centersquare8534 Concord Center Dr80112 Englewood,/usa/colorado/denver/cyxtera-den2a/
Colorado,Denver,EdgeConneX Denver - EDCDEN02,EdgeConneX8451 Highfield Pkwy80112 Englewood,/usa/colorado/denver/edgeconnex-den02/
Colorado,Denver,Expedient Centennial,Expedient Data Centers7347 S Revere Pkwy80112 Centennial,/usa/colorado/denver/expedient-centennial/
Colorado,Denver,Colorado Colo,Colorado Colo11100 West 8th Ave80215 Lakewood,/usa/colorado/denver/colorado-colo/
Colorado,Denver,Equinix DE2,"Equinix335 Inverness Drive South, Inverness Business Park80112 Englewood",/usa/colorado/denver/equinix-de2/
Colorado,Denver,Centersquare - Denver DEN1-B,Centersquare9110 Commerce Center Circle80129 Highland Ranch,/usa/colorado/denver/cyxtera-den2b/
Colorado,Denver,Equinix DE1,Equinix9706 E. Easter Avenue80112 Englewood,/usa/colorado/denver/switchdata-denver/
Colorado,Denver,Lumen Denver 1,Lumen1850 Pearl Street80203 Denver,/usa/colorado/denver/level3-denver/
Colorado,Denver,Lumen Aurora,Lumen23901 E 6th Ave80018 Aurora,/usa/colorado/denver/lumen-aurora/
Colorado,Denver,Icelab Networks,Icelab Networkswithin County Line & I-2580120 Littleton,/usa/colorado/denver/icelab-networks/
Colorado,Denver,Lumen Denver 2,Lumen14200 E Jewell Ave80012 Aurora,/usa/colorado/denver/twtc-denver/
Colorado,Denver,Massive Networks-Boulder,Massive Networks382 S. Arthur Ave80027 Louisville,/usa/colorado/denver/rockynetcom/
Colorado,Denver,Lumen Denver 3,Lumen910 15th Street80202 Denver,/usa/colorado/denver/level3-denver3/
Colorado,Denver,Cogent Denver,"Cogent Communications, Inc.4643 S Ulster St80237 Denver",/usa/colorado/denver/cogent-denver/
Colorado,Denver,Handy Networks,"Handy Networks, LLC1801 California St80202 Denver",/usa/colorado/denver/handy-networks/
Colorado,Denver,Earthnet Data Center Boulder,Earthnet Data Center and Consulting Boulder Colorado4735 Walnut St80301 Boulder,/usa/colorado/denver/earthnet-boulder/
Colorado,Denver,DENVER-01,FORETHOUGHT.net2347 Curtis St80205 Denver,/usa/colorado/denver/denver-01/
Colorado,Denver,910Telecom,"DGEB Management, LLC910 15th Street80202 Denver",/usa/colorado/denver/910telecom/
Colorado,Denver,Massive Networks - Denver,Massive Networks910 15th st.80202 Denver,/usa/colorado/denver/massive-denver/
Colorado,Denver,Thornton Colorado Data Center,Morgan Reed Group12121 Grant Street80241 Thornton,/usa/colorado/denver/thornton-colorado-data-center/
Colorado,Denver,Clear Channel Satellite,Clear Channel Satellite76 Inverness Drive East80112 Englewood,/usa/colorado/denver/clear-channel-satellite/
Colorado,Denver,"Vastnet - Denver, CO",Vastnet800E 73rd Av80229 Denver,/usa/colorado/denver/vastnet-denver-co/
Colorado,Denver,Edge Data Center - Boulder,American Tower Corporation9110 Interlocken Loop80021 Broomfield,/usa/colorado/denver/edge-dc-boulder/
Colorado,Denver,Edge Data Center - Denver,American Tower Corporation5041 Broadway27587 Denver,/usa/colorado/denver/edge-dc-denver/
Colorado,Denver,365 Data Centers - SungardAS Thornton,365 Data Centers550 East 84th Street80229 Thornton,/usa/colorado/denver/sungardas-thornton/
Colorado,Denver,9706 E. Easter Avenue,Unknown Company9706 E. Easter Avenue80112 Englewood,/usa/colorado/denver/9706-e-easter-avenue/
Colorado,Denver,XO Denver,XO Communications313 Inverness Way South80112 Englewood,/usa/colorado/denver/xo-denver1/
Colorado,Denver,XO Englewood,XO Communications9706 E. Easter Avenue80112 Englewood,/usa/colorado/denver/xo-denver2/
Colorado,Denver,4dv.net,4dv.net6 Inverness Drive East80112 Englewood,/usa/colorado/denver/4dv/
Colorado,Denver,HOSTING - Denver,HOSTING900 S. Broadway80209 Denver,/usa/colorado/denver/hosting-denver/
Colorado,Loveland,CorKat Data,CorKat DataP.O. Box 745180537 Loveland,/usa/colorado/loveland/corkat-data/
Colorado,Colorado Springs,ColoHouse Colorado Springs,ColoHouse102 S. Tejon Street80903 Colorado Springs,/usa/colorado/colorado-springs/colohouse-colorado-springs/
Colorado,Colorado Springs,Lumen Colorado Springs 2,Lumen102 S. Tejon Street80903 Colorado Springs,/usa/colorado/colorado-springs/level3-colorado-springs2/
Colorado,Colorado Springs,Springs Hosting,Springs Hosting1205 Shasta Dr.80910 Colorado Springs,/usa/colorado/colorado-springs/springs-hosting/
Colorado,Colorado Springs,Plaza of the Rockies West Tower,Unknown Company102 South Tejon Street80903 Colorado Springs,/usa/colorado/colorado-springs/plaza-of-the-rockies-west-tower/
Colorado,Colorado Springs,tw telecom Colorado Springs,tw telecom102 South Tejon Street80903 Colorado Springs,/usa/colorado/colorado-springs/twtc-colorado-springs/
Colorado,Fort Collins,FRII,FRII3350 Eastbrook Dr.80525 Fort Collins,/usa/colorado/fort-collins/frii/
Indiana,Indianapolis,DataBank IND2 - Downtown Indianapolis,DataBank650 W. Henry Street46225 Indianapolis,/usa/indiana/indianapolis/lightbound-650/
Indiana,Indianapolis,Netrality - Indy Telcom Center,Netrality733 W Henry St46225 Indianapolis,/usa/indiana/indianapolis/netrality-indy-telcom-center/
Indiana,Indianapolis,OTAVA Indianapolis,OTAVA505 West Merrill Street46225 Indianapolis,/usa/indiana/indianapolis/indianapolis-1-data-center/
Indiana,Indianapolis,Expedient Indianapolis,Expedient Data Centers701 Congressional Blvd46032 Indianapolis,/usa/indiana/indianapolis/expedient-indianapolis/
Indiana,Indianapolis,DataBank IND1 - Downtown Indianapolis,DataBank731 West Henry Street46225 Indianapolis,/usa/indiana/indianapolis/lightbound-731-henry-street/
Indiana,Indianapolis,365 Data Centers - Indianapolis,365 Data Centers701 West Henry Street46225 Indianapolis,/usa/indiana/indianapolis/365main-indianapolis/
Indiana,Indianapolis,Lifeline Data Centers Eastgate,"Lifeline Data Centers, LLC401 North Shadeland Avenue46219 Indianapolis",/usa/indiana/indianapolis/eastgate-in/
Indiana,Indianapolis,DataBank IND - 800 Oliver DataBank,DataBank800 Oliver Street46225 Indianapolis,/usa/indiana/indianapolis/lightbound-800-oliver/
Indiana,Indianapolis,Lumen Indianapolis 1,Lumen1902 S. East Street46225 Indianapolis,/usa/indiana/indianapolis/level3-indianapolis1/
Indiana,Indianapolis,Lumen Indianapolis 2,Lumen4625 W 86th St46268 Indianapolis,/usa/indiana/indianapolis/twtc-indianapolis/
Indiana,Indianapolis,Lifeline Data Centers Henry,"Lifeline Data Centers, LLC733 W Henry St.46225 Indianapolis",/usa/indiana/indianapolis/lifeline-data-centers/
Indiana,Indianapolis,"Oliver Street, LLC","Oliver Street, LLC/Paragon Realty800 Oliver Ave.46225 Indianapolis",/usa/indiana/indianapolis/oliver-street/
Indiana,Indianapolis,nGenX - Indianapolis,nGenX701 W Henry Street46225 Indianapolis,/usa/indiana/indianapolis/ngenx-indianapolis/
Indiana,Indianapolis,nGenx - Lafayette,nGenX2304 Brothers Drive47909 Lafayette,/usa/indiana/indianapolis/ngenx---lafayette/
Indiana,Indianapolis,LGI Broad Ripple,LifeGrid Interent1810 Broad Ripple Ave46220 Indianapolis,/usa/indiana/indianapolis/lgi-broad-ripple/
Indiana,Indianapolis,701 West Henry Street,Indy Telcom Center701 West Henry Street46225 Indianapolis,/usa/indiana/indianapolis/701-west-henry/
Indiana,Indianapolis,GAP Indy Data Center,Global Access Point800 Henry Street46225 Indianapolis,/usa/indiana/indianapolis/gap-indy-data-center/
Indiana,South Bend,GAP Union Station,Global Access Point506 W. South Street46601 South Bend,/usa/indiana/south-bend/gap-union-station/
Indiana,South Bend,Data Realty,Data Realty1440 Ignition Drive46601 South Bend,/usa/indiana/south-bend/data-realty/
Indiana,South Bend,Lumen SouthBend 1,Lumen1140 Franklin Street46601 South Bend,/usa/indiana/south-bend/level3-southbend1/
Indiana,South Bend,Colostore.com,Colostore Data Center1805 South Michigan46613 South Bend,/usa/indiana/south-bend/colostorecom/
Indiana,South Bend,South Bend Data Center,"Five 9s Digital, LLC3919 Crescent Circle46628 South Bend",/usa/indiana/south-bend/south-bend-data-center/
Indiana,South Bend,CBTS South Bend Data Center II,Cincinnati Bell Technology Solutions22 Maple Hill Run46601 South Bend,/usa/indiana/south-bend/cbts-south-bend-data-center-ii/
Indiana,South Bend,CBTS South Bend Data Center I,Cincinnati Bell Technology Solutions123 Sycamore Lane46601 South Bend,/usa/indiana/south-bend/cbts-south-bend-data-center-i/
Indiana,South Bend,Digital Enterprise Center,Global Access Point4001 Technology Drive46628 South Bend,/usa/indiana/south-bend/digital-enterprise-center/
Indiana,South Bend,GramTel Blactkhorn,GramTel3919 Crescent Circle46628 South Bend,/usa/indiana/south-bend/gramtel-blactkhorn/
Indiana,Noblesville,ORI.NET Noblesville,"On-Ramp Indiana, Inc.859 Conner street46060 Noblesville",/usa/indiana/noblesville/orinet-noblesville/
Indiana,Evansville,nGenX - Evansville,nGenX3701 Communications Way47715 Evansville,/usa/indiana/evansville/ngenx-evansville/
Indiana,Evansville,Sitco Data Center,Sitco Data Center4631 O47711 Evansville,/usa/indiana/evansville/sitco-data-center/
Indiana,Fort Wayne,Indiana Data center,"Indiana Data Center, LLC.620 W. Coliseum Boulevard46808 Fort Wayne",/usa/indiana/fort-wayne/indiana-data-center/
Indiana,Fort Wayne,SafeHouse Datacenter,safehosue datacenter9813 Dawson Creek Blvd46825 Fort Wayne,/usa/indiana/fort-wayne/safehouse-datacenter/
Indiana,Hammond,DX-1,Digital Crossroad100 Digital Crossroads Drive46320 Hammond,/usa/indiana/hammond/dx-1/
Indiana,Columbus In,DartPoints Columbus,DartPoints2425 Technology Blvd47201 Columbus,/usa/indiana/columbus-in/data-cave/
Indiana,Jeffersonville,Meta Jeffersonville Data Center,METAwithin the River Ridge Commerce Center in Jeffersonville47130 Jeffersonville,/usa/indiana/jeffersonville/meta-jeffersonville-data-center/
Utah,Salt Lake City,Flexential Salt Lake City - Downtown Data Center,Flexential572 South Delong Street84104 Salt Lake City,/usa/utah/salt-lake-city/flexential-slc-downtown/
Utah,Salt Lake City,Flexential Salt Lake City - Lindon Data Center,Flexential333 South 520 West84042 Lindon,/usa/utah/salt-lake-city/flexential-slc-lindon/
Utah,Salt Lake City,Flexential Salt Lake City - Millcreek Data Center,Flexential3949 South 200 East84107 Salt Lake City,/usa/utah/salt-lake-city/flexential-slc-east/
Utah,Salt Lake City,Flexential Salt Lake City - Fair Park Data Center,Flexential118 South 10th West84104 Salt Lake City,/usa/utah/salt-lake-city/flexential-slc-west/
Utah,Salt Lake City,Flexential Salt Lake City - South Valley Data Center,Flexential7202 South Campus View Drive84084 West Jordan,/usa/utah/salt-lake-city/flexential-slc-south-valley/
Utah,Salt Lake City,EdgeConneX Salt Lake City-EDCSLC01,EdgeConneX2302 South Presidents Drive84120 West Valley City,/usa/utah/salt-lake-city/edcslc01/
Utah,Salt Lake City,Aligned SLC-02,Aligned Data Centers3333 West 9000 South84088 West Jordan,/usa/utah/salt-lake-city/aligned-slc-02/
Utah,Salt Lake City,Aligned SLC-01,Aligned Data Centers3333 West 9000 South84088 West Jordan,/usa/utah/salt-lake-city/aligned-slc-01/
Utah,Salt Lake City,DataBank SLC4 - Granite Point,DataBank14860 Pony Express Rd84065 Bluffdale,/usa/utah/salt-lake-city/databank-slc4-granite-point/
Utah,Salt Lake City,DataBank SLC6 - Granite Point,DataBank14870 Pony Express Rd84065 Bluffdale,/usa/utah/salt-lake-city/databank-slc6-granite-point/
Utah,Salt Lake City,DataBank SLC5 - Granite Point,DataBank14850 Pony Express Rd84065 Bluffdale,/usa/utah/salt-lake-city/databank-slc5-granite-point/
Utah,Salt Lake City,DataBank SLC3 - Granite Point West,DataBank14926 Pony Express Road84065 Bluffdale,/usa/utah/salt-lake-city/databank-granite-point-west/
Utah,Salt Lake City,DataBank SLC1 - Downtown Salt Lake City,DataBank179 Social Hall Avenue84111 Salt Lake City,/usa/utah/salt-lake-city/databank-slc1/
Utah,Salt Lake City,DataBank SLC2 - Granite Point East,DataBank14944 Pony Express Road84065 Bluffdale,/usa/utah/salt-lake-city/databank-slc2/
Utah,Salt Lake City,Salt Lake City Campus,Aligned Data Centers3333 W 9000 S84088 West Jordan,/usa/utah/salt-lake-city/salt-lake-city-campus/
Utah,Salt Lake City,XMission Data Center,XMission67 E. 400 S.84111 Salt Lake City,/usa/utah/salt-lake-city/xmission-data-center/
Utah,Salt Lake City,Novva Flagship,Novva6477 Wells Park Rd84081 West Jordan,/usa/utah/salt-lake-city/novva-flagship/
Utah,Salt Lake City,CirrusDS View 78 Data Center,Cirrus Data Services983 W Center Street84047 Midvale,/usa/utah/salt-lake-city/cirrusds-view78/
Utah,Salt Lake City,Lumen Salt Lake City 2,Lumen5035 Harold Gatty Drive84116 Salt Lake City,/usa/utah/salt-lake-city/level3-salt-lake-city2/
Utah,Salt Lake City,Consonus SDC,"Consonus Technologies, Inc.within 20 miles of downtown Salt Lake City84084 West Jordan",/usa/utah/salt-lake-city/consonus-sdc/
Utah,Salt Lake City,Consonus PDC,"Consonus Technologies, Inc.within 7 miles of downtown Salt Lake City84120 West Valley City",/usa/utah/salt-lake-city/consonus-pdc/
Utah,Salt Lake City,Consonus WDC,"Consonus Technologies, Inc.within 2 miles of downtown Salt Lake City84104 Salt Lake City",/usa/utah/salt-lake-city/consonus-wdc/
Utah,Salt Lake City,2302 South Presidents Drive,Unknown Company2302 South Presidents Drive84120 West Valley City,/usa/utah/salt-lake-city/2302-s-presidents-dr/
Utah,Salt Lake City,Voonami Salt Lake City Data Center,Voonami Inc2302 South Presidents Drive84120 West Valley City,/usa/utah/salt-lake-city/salt-lake-city-data-center/
Utah,Orem,Meta Eagle Mountain Data Center,METAEast 1000 North84005 Eagle Mountain,/usa/utah/orem/meta-eagle-mountain-data-center/
Utah,Orem,Fibernet Corp,Fibernet Corp1155 S 800 E84097 Orem,/usa/utah/orem/fibernet-corporation/
Utah,Orem,Voonami Orem Data Center,"Voonami Inc510 E Technology Avenue, Building C84097 Orem",/usa/utah/orem/orem-data-center/
Utah,Orem,C7 Data Centers - Orem,"C7 Data Centers, Inc.703 East Technology Ave.84097 Orem",/usa/utah/orem/c7-data-centers-orem/
Utah,Orem,C7 Data Centers - Lindon,"C7 Data Centers, Inc.357 South 670 West84042 Lindon",/usa/utah/orem/c7-data-centers-lindon/
Utah,St George,Tonaquint Saint George Data Center,"Tonaquint Data Centers, Inc.1108 West 1600 South, Bldg D84770 St George",/usa/utah/st-george/tonaquint-stg/
Utah,Ogden,Lumen Ogden 1,Lumen526 W 17th Street84404 Ogden,/usa/utah/ogden/level3-ogden-1/
Nebraska,Omaha,TierPoint Omaha-Bellevue,TierPoint1001 Fort Crook Road North68005 Bellevue,/usa/nebraska/omaha/cosentry/
Nebraska,Omaha,TierPoint Omaha-Midlands,TierPoint11425 S. 84th St.68046 Papillion,/usa/nebraska/omaha/cosentry-midlands/
Nebraska,Omaha,LightEdge - Omaha,LightEdge1148 American Parkway68046 Papillion,/usa/nebraska/omaha/lightedge-omaha/
Nebraska,Omaha,Lumen Omaha 1,Lumen6805 Pine St68106 Omaha,/usa/nebraska/omaha/lumen-omaha-1/
Nebraska,Omaha,Lumen Bellevue,Lumen1514 Chandler Road West68147 Bellevue,/usa/nebraska/omaha/lumen-bellevue/
Nebraska,Omaha,1623 Farnam,1623 Farnam1623 Farnam Street68102 Omaha,/usa/nebraska/omaha/1623-farnam/
Nebraska,Omaha,LoCoCoLo,"Power PRotection Products, Inc.1207 South68124 Omaha",/usa/nebraska/omaha/lococolo/
Nebraska,Omaha,First National Technology Solutions,First National Technology Solutions201 N 16th St68197 Omaha,/usa/nebraska/omaha/first-national-technology-solutions/
Nebraska,Omaha,Scott Data Center,The Scott Technology Tranfer and Incubator Center6825 Pine St.68106 Omaha,/usa/nebraska/omaha/scott-data-center/
Nebraska,Papillion,Google Papillion Data Center,Google14706 Schram Rd68138 Papillion,/usa/nebraska/papillion/google-papillion/
Nebraska,Papillion,Meta Sarpy Data Center,META14734 Friend Plz68059 Papillion,/usa/nebraska/papillion/meta-sarpy-data-center/
Nebraska,Lincoln,NDC Sharp Annex,Nebraska Data Centers206 S. 13th Street68508 Lincoln,/usa/nebraska/lincoln/ndc-sharp-annex/
Nebraska,Lincoln,Binary.net,Binary Net134 S. 13th St.68508 Lincoln,/usa/nebraska/lincoln/binary-net/
Nebraska,Grand Island,Hamilton Managed Hosting,Hamilton Managed Hosting1006 12th Street68818 Aurora,/usa/nebraska/grand-island/hamilton-managed-hosting/
Minnesota,Minneapolis,Cologix MIN1,Cologix511 11th Ave South55415 Minneapolis,/usa/minnesota/minneapolis/the-minnesota-gateway/
Minnesota,Minneapolis,Flexential Minneapolis - Chaska Data Center,Flexential3500 Lyman Blvd55318 Chaska,/usa/minnesota/minneapolis/flexential-chaska/
Minnesota,Minneapolis,Cologix MIN3,Cologix511 11th Ave S55415 Minneapolis,/usa/minnesota/minneapolis/cologix-min3/
Minnesota,Minneapolis,Cologix MIN2,Cologix511 11th Ave S55415 Minneapolis,/usa/minnesota/minneapolis/cologix-min2/
Minnesota,Minneapolis,Cologix MIN4,Cologix511 11th Ave S55415 Minneapolis,/usa/minnesota/minneapolis/cologix-min4/
Minnesota,Minneapolis,Cologix MIN5,Cologix511 11th Ave S55415 Minneapolis,/usa/minnesota/minneapolis/cologix-min5/
Minnesota,Minneapolis,Meta Rosemount Data Center,METAwithin east of Dakota County Technical College55068 Rosemount,/usa/minnesota/minneapolis/meta-rosemount-data-center/
Minnesota,Minneapolis,OneNeck Minneapolis,OneNeck IT Solutions10290 W 70th St55344 Eden Prairie,/usa/minnesota/minneapolis/visi/
Minnesota,Minneapolis,EdgeConneX Minneapolis - EDCMSP01,EdgeConneX6875 Shady Oak Rd55344 Eden Prairie,/usa/minnesota/minneapolis/edgeconnex-edcmsp01/
Minnesota,Minneapolis,LightEdge - Minneapolis I,LightEdge1708 West Creek Lane55318 Chaska,/usa/minnesota/minneapolis/minneapolis/
Minnesota,Minneapolis,DataBank MSP1 - West Twin Cities,DataBank7700 France Avenue S.55435 Minneapolis,/usa/minnesota/minneapolis/databank-minneapolis/
Minnesota,Minneapolis,DataBank MSP3 - Brooklyn Park,DataBank8111 Oxbow Creek N55445 Brooklyn Park,/usa/minnesota/minneapolis/databank-msp3-brooklyn-park/
Minnesota,Minneapolis,Centersquare - Minneapolis MSP1,Centersquare4450 Dean Lakes Blvd55413 Shakopee,/usa/minnesota/minneapolis/cyxtera-msp2/
Minnesota,Minneapolis,DataBank MSP2 - East Twin Cities,DataBank3255 Neil Armstrong Boulevard55121 Minneapolis,/usa/minnesota/minneapolis/databank-se-minneapolis/
Minnesota,Minneapolis,DataBank MSP4 - Downtown,DataBank511 11th Avenue S55145 Minneapolis,/usa/minnesota/minneapolis/databank-msp4/
Minnesota,Minneapolis,Lumen Minnetonka 1,Lumen5500 Feltl Rd55343 Minnetonka,/usa/minnesota/minneapolis/lumen-minnetonka-1/
Minnesota,Minneapolis,Unisys Eagan DC,Jones Lang LaSalle3199 Pilot Knob Rd.55121 Eagan,/usa/minnesota/minneapolis/unisys-eagan-dc/
Minnesota,Minneapolis,IronGate Data Centers -  East,IronGate Data Centerswithin 5 miles of I-494 and I-9455101 St. Paul Suburbs,/usa/minnesota/minneapolis/twin-cities-east/
Minnesota,Minneapolis,IronGate Data Centers - Northwest,IronGate Data Centerswithin 5 miles from I-494 and I-9455402 Minneapolis Suburbs,/usa/minnesota/minneapolis/twin-cities-northwest/
Minnesota,Minneapolis,Lumen Minnetonka 2,Lumen5480 Feltl Rd55343 Minnetonka,/usa/minnesota/minneapolis/twtc-minnetonka/
Minnesota,Minneapolis,Lumen Minneapolis 3,Lumen715 N 2nd Street55401 Minneapolis,/usa/minnesota/minneapolis/level3-minneapolis3/
Minnesota,Minneapolis,Lumen Minneapolis 2,Lumen511 11th Avenue South55415 Minneapolis,/usa/minnesota/minneapolis/level3-minneapolis2/
Minnesota,Minneapolis,DataBank - zColo - 10300 6th Ave,DataBank10300 6th Ave55441 Plymouth,/usa/minnesota/minneapolis/zcolo-10300-6th-ave/
Minnesota,Minneapolis,Lumen Minneapolis 1,Lumen222 S 9th Street55402 Minneapolis,/usa/minnesota/minneapolis/level3-minneapolis1/
Minnesota,Minneapolis,NP Rochester,Neutral Path Communications LLC220 S Broadway LL-1255901 Rochester,/usa/minnesota/minneapolis/np-rochester/
Minnesota,Minneapolis,Cogent Minneapolis,"Cogent Communications, Inc.250 Marquette Ave55401 Minneapolis",/usa/minnesota/minneapolis/cogent-minneapolis/
Minnesota,Minneapolis,T5@Minneapolis,Legacy Investing1001 3rd Ave S55404 Minneapolis,/usa/minnesota/minneapolis/t5-minneapolis/
Minnesota,Minneapolis,US Internet,US Internet12450 Wayzata Blvd55305 Minnetonka,/usa/minnesota/minneapolis/us-internet/
Minnesota,Minneapolis,BHI NOC,BHI Advanced Internet7599 Corporate Way55344 Eden Prairie,/usa/minnesota/minneapolis/bhi-noc/
Minnesota,Minneapolis,ABcom,ABcom213 Old Highway 8 SW55112 New Brighton,/usa/minnesota/minneapolis/abcom/
Minnesota,Minneapolis,ipHouse,ipHouse331 2nd Ave S55401 Minneapolis,/usa/minnesota/minneapolis/iphouse-minneapolis/
Minnesota,Minneapolis,511 Building,Unknown Company511 11th Avenue South55415 Minneapolis,/usa/minnesota/minneapolis/511-building/
Minnesota,Minneapolis,250 Marquette Avenue,Unknown Company250 Marquette Avenue55401 Minneapolis,/usa/minnesota/minneapolis/250-marquette/
Minnesota,Minneapolis,XO Minneapolis,"XO Communications250 Marquette Avenue, 1st FL55401 Minneapolis",/usa/minnesota/minneapolis/xo-minneapolis/
Minnesota,Minneapolis,tw telecom Minneapolis,tw telecom511 11th Ave S55415 Minneapolis,/usa/minnesota/minneapolis/twtc-minneapolis/
Minnesota,Braham,RevNet Datacenter #1,"Revelation Network Management, Inc.205 2nd Street SW55006 Braham",/usa/minnesota/braham/revnet1/
Minnesota,Cambridge Mn,RevNet Datacenter #2,"Revelation Network Management, Inc.1100 16th Ave SE55008 Cambridge",/usa/minnesota/cambridge-mn/revnet2/
Minnesota,Duluth,Involta Duluth 1,Involta3401 Technology Drive55811 Duluth,/usa/minnesota/duluth/involta-duluth/
Minnesota,Duluth,Involta Duluth 2,Involta421 N. 6th Ave. East55805 Duluth,/usa/minnesota/duluth/involta-duluth2/
Minnesota,Bemidji,PBC Bemidji Data Center,Paul Bunyan Communications1831 Anne ST NW56601 Bemidji,/usa/minnesota/bemidji/pbc-bemidji-data-center/
Minnesota,Alexandria Mn,Vaultas Alexandria,Vaultas720 Hawthorne St56308 Alexandria,/usa/minnesota/alexandria-mn/vaultas-alexandria/
Minnesota,Saint Paul,H5 Data Centers Minneapolis,H5 Data Centers1125 Energy Park Dr55108 Saint Paul,/usa/minnesota/saint-paul/h5-minneapolis/
Oklahoma,Oklahoma City,TierPoint Oklahoma City #1,TierPoint4121 Perimeter Center Dr.73112 Oklahoma City,/usa/oklahoma/oklahoma-city/oklahoma-city-data-center/
Oklahoma,Oklahoma City,TierPoint Oklahoma City #2,TierPoint4114 Perimeter Center Place73112 Oklahoma City,/usa/oklahoma/oklahoma-city/perimeter-technology-data-center/
Oklahoma,Oklahoma City,Tonaquint Oklahoma City Data Center,"Tonaquint Data Centers, Inc.4442 Newcastle Rd73119 Oklahoma City",/usa/oklahoma/oklahoma-city/edgexdc-okc/
Oklahoma,Oklahoma City,RACK59,RACK59 Data Center7725 W Reno Avenue73127 Oklahoma City,/usa/oklahoma/oklahoma-city/rack59/
Oklahoma,Oklahoma City,Lumen Oklahoma City 1,Lumen201 Robert S Kerr Blvd73102 Oklahoma City,/usa/oklahoma/oklahoma-city/level3-oklahoma-city1/
Oklahoma,Oklahoma City,MIDCON Recovery Solutions,MIDCON Recovery Solutions13431 N. Broadway Extension73114 Oklahoma City,/usa/oklahoma/oklahoma-city/midcon-recovery-solutions/
Oklahoma,Oklahoma City,TulsaConnect (DC4) Oklahoma,TulsaConnect701 N. Broadway Ave.73102 Oklahoma City,/usa/oklahoma/oklahoma-city/tulsaconnect-dc4/
Oklahoma,Tulsa,TierPoint Tulsa - Archer,TierPoint322 E. Archer74120 Tulsa,/usa/oklahoma/tulsa/tulsa-data-center/
Oklahoma,Tulsa,TierPoint Tulsa - State Farm,TierPoint12151 E. State Farm Boulevard74146 Tulsa,/usa/oklahoma/tulsa/tierpoint-tulsa-state-farm/
Oklahoma,Tulsa,Jackson Technical Data Center,Jackson Technical611 S Elgin Ave74120 Tulsa,/usa/oklahoma/tulsa/jackson-technical-data-center/
Oklahoma,Tulsa,OCOSA Data Center,"OCOSA Communication, LLC321 S. Boston Ave.74103 Tulsa",/usa/oklahoma/tulsa/ocosa-data-center/
Oklahoma,Tulsa,Google Mayes County Data Center,Google4581 Webb St74361 Pryor,/usa/oklahoma/tulsa/google-mayes-county/
Oklahoma,Tulsa,CORE Data Center,CORE Data Center27039 S. 4440 Rd.74301 Vinita,/usa/oklahoma/tulsa/core-data-center/
Oklahoma,Tulsa,Lumen Tulsa 1,Lumen18 W. Archer Street74103 Tulsa,/usa/oklahoma/tulsa/level3-tulsa1/
Oklahoma,Tulsa,Philcade Data Center,Kanbar Properties501 South Boston74103 Tulsa,/usa/oklahoma/tulsa/philcade-data-center/
Oklahoma,Tulsa,Tulsa Technology Exchange,Facility Gateway Corporation509 S Boston Ave74103 Tulsa,/usa/oklahoma/tulsa/tulsa-technology-exchange/
Oklahoma,Tulsa,TulsaConnect (DC3) Oklahoma,TulsaConnect4500 S. 129th E Ave74134 Tulsa,/usa/oklahoma/tulsa/tulsaconnect-data-center-dc3/
Oklahoma,Tulsa,TulsaConnect (DC2) Oklahoma,TulsaConnect110 W. 7th St74119 Tulsa,/usa/oklahoma/tulsa/tulsaconnect-data-center-dc2/
Oklahoma,Tulsa,TulsaConnect (DC1) Oklahoma,TulsaConnect321 S. Boston Ave74103 Tulsa,/usa/oklahoma/tulsa/tulsaconnect-data-center/
Oklahoma,Tulsa,Isocentric Networks,"isocentric networks inc.100 West 5th Street, STE 70574103 Tulsa",/usa/oklahoma/tulsa/isocentric-networks/
Oklahoma,Tulsa,Kennedy Building,"BAM, LLC.321 South Boston Avenue74103 Tulsa",/usa/oklahoma/tulsa/kennedy-building/
