State,City,Header,Description,Link
New York,Buffalo,325 Delware Avenue,The Benchmark Group325 Delaware Avenue14202 Buffalo,/usa/new-york/buffalo/325delaware/
New York,Buffalo,350 Main Place,Main Place Liberty Group350 Main Street14202 Buffalo,/usa/new-york/buffalo/350-main-place/
New York,Albany,ColoHouse Albany,ColoHouse175 Old Loudon Road12110 Latham,/usa/new-york/albany/colohouse-albany/
New York,Albany,Lumen Albany 3,Lumen11 North Pearl Street12207 Albany,/usa/new-york/albany/lumen-albany-3/
New York,Albany,FirstLight Albany NY,FirstLight Fiber11 North Pearl12207 Albany,/usa/new-york/albany/firstlight-albany/
New York,Albany,HostRocket,HostRocket21 Corporate Dr12065 Clifton Park,/usa/new-york/albany/hostrocket/
New York,Albany,Lumen Albany 4,Lumen10 Airline Dr12205 Colonie,/usa/new-york/albany/twtc-albany/
New York,Albany,Lumen Albany 2,Lumen194 Washington Avenue12210 Albany,/usa/new-york/albany/level3-albany2/
New York,Albany,Lumen Albany 1,Lumen316 North Pearl Street12207 Albany,/usa/new-york/albany/level3-albany1/
New York,Albany,INOC Data Centers,INOC Data Centers4 Tower Place12203 Albany,/usa/new-york/albany/inoc-tower-place/
New York,Albany,INOC Data Centers,INOC Data Centers80 State Street12207 Albany,/usa/new-york/albany/inoc/
New York,Albany,80 State Street,Unknown Company80 State Street12207 Albany,/usa/new-york/albany/80-state-street/
New York,Albany,194 Washington Avenue,Unknown Company194 Washington Avenue12210 Albany,/usa/new-york/albany/194-washington/
New York,Albany,Fibertech Albany,Fibertech Networks80 State Street12207 Albany,/usa/new-york/albany/fibertech-albany/
New York,Long Island,mindSHIFT Commack,365 Data Centers500 Commack Dr11725 Commack,/usa/new-york/long-island/mindshift-commack/
New York,Long Island,Long Island Interconnect,Long Island Interconnect1025 Old Country Road11590 Westbury,/usa/new-york/long-island/1025connect/
New York,Long Island,Stafford Assoicates,Stafford Associates21 Bennetts Road11733 Setauket,/usa/new-york/long-island/stafford-assoicates/
New York,Long Island,PointVoIP NY3,"PointVoIP, LLC3385 Veterans Memorial Hwy11779 Ronkonkoma",/usa/new-york/long-island/pointvoip-ny3/
New York,Long Island,Lumen Garden City 1,Lumen71 Clinton Road11530 Garden City,/usa/new-york/long-island/level3-long-island/
New York,Long Island,CNS Colo,CNS Colo131 Hoffman Ln11749 Islandia,/usa/new-york/long-island/cns-colo/
New York,Long Island,TWS Hosting,TWS Hosting140 Hoffman Lane11749 Islandia,/usa/new-york/long-island/tws-hosting/
New York,Long Island,Vastnet - Melville,Vastnet680 Walt Whitman Road11747 Melvile,/usa/new-york/long-island/vastnet-melville/
New York,Long Island,Gotham Bus,The Gotham Bus Company Inc.449 Route 25A11766 Mt. Sinai,/usa/new-york/long-island/gotham-bus/
New York,Long Island,"Lightower Farmingdale, NY",Lightower Fiber Networks115 Bi County Boulevard11735 Farmingdale,/usa/new-york/long-island/lightower-farmingdale-ny/
New York,Long Island,Continuity Centers,"American Business Continuity Centers, LLC.1000 Woodbury Rd11797 Woodbury",/usa/new-york/long-island/continuity-centers/
New York,Long Island,GET Long Island,"Global Enterprise Technologies, Inc.Tec Street11805 Hicksville",/usa/new-york/long-island/get-long-island/
New York,Wappingers Falls,CyrusOne NYM7 - Wappingers Falls,CyrusOne Data Centers55 Myers Corners Road12590 Wappingers Falls,/usa/new-york/wappingers-falls/new-york-data-center/
New York,Syracuse,Lumen Syracuse 1,Lumen2 N Clinton St13202 Syracuse,/usa/new-york/syracuse/lumen-syracuse-1/
New York,Syracuse,Lumen East Syracuse,Lumen6007 Fair Lakes Rd13057 East Syracuse,/usa/new-york/syracuse/lumen-east-syracuse/
New York,Syracuse,Syracuse Data Center,Westelcom109 South Warren Street13202 Syracuse,/usa/new-york/syracuse/syracuse-data-center/
New York,Syracuse,Northland Syracuse Datacenter,Northland Communications500 South Salina Street13202 Syracuse,/usa/new-york/syracuse/northland-syracuse-datacenter/
New York,Syracuse,NaviSite Syracuse,"NaviSite, Inc.125 Elwood Davis Road13212 Syracuse",/usa/new-york/syracuse/navisite-syracuse/
New York,Watertown,Watertown Data Center,Westelcom130 Park Place13601 Watertown,/usa/new-york/watertown/watertown-data-center/
New York,Binghamton,tw telecom Binghamton,tw telecom144 Henry St13901 Binghamton,/usa/new-york/binghamton/twtc-binghamton/
New York,Potsdam,colo@OldMain,Clarkson University55 Main Street13676 Potsdam,/usa/new-york/potsdam/colo-oldmain/
New York,Westchester County,TierPoint Hawthorne - New York,TierPoint11 Skyline Dr.10528 Hawthorne,/usa/new-york/westchester-county/xand-corporation/
New York,Westchester County,TierPoint Harthorne 2 - New York,TierPoint17 Skyline Drive10532 Hawthorne,/usa/new-york/westchester-county/tierpoint-hw2/
New York,Westchester County,Equinix NY13,Equinix401 Fieldcrest Drive10523 Elmsford,/usa/new-york/westchester-county/equinix-ny13/
New York,Westchester County,CROWN CASTLE (NY2),CROWN CASTLE360 Hamilton Avenue10601 White Plains,/usa/new-york/westchester-county/rcn-metro-360-hamilton/
New York,Westchester County,Cohere Communications - Westchester,Cohere Communications777 Old Saw Mill River Rd10591 Tarrytown,/usa/new-york/westchester-county/cohere-westchester/
New York,Westchester County,Continuity Centers Hawthorne,"American Business Continuity Centers, LLC.11 Skyline Dr.10532 Hawthorne",/usa/new-york/westchester-county/continuity-centers-chappaqua/
New York,Plattsburgh,PLattsburgh Data Center,Westelcom24 Margaret Street12901 Plattsburgh,/usa/new-york/plattsburgh/plattsburgh-data-center/
New York,Romulus,FLTG Park,"Finger Lakes Technologies Group, Inc4902 McGrane Road14541 Romulus",/usa/new-york/romulus/fltg-park/
New York,Utica,Northland Utica Datacenter,"Northland Communications258 Genesee Street, Utica13502 Utica",/usa/new-york/utica/northland-utica-datacenter/
New York,Yorktown Heights,GlobeOp,GlobeOp1565 Front Street10598 Yorktown Heights,/usa/new-york/yorktown-heights/globeop/
Oregon,Portland,3825 NW Aloclek Street (PDX10),Digital Realty3825 NW Aloclek Street97124 Hillsboro,/usa/oregon/portland/telx-prt1/
Oregon,Portland,Flexential Portland - Hillsboro 3 Data Center,Flexential5419 NE Starr Blvd97124 Hillsboro,/usa/oregon/portland/flexential-hillsboro3/
Oregon,Portland,Flexential Portland - Hillsboro 2 Data Center,Flexential5737 NE Huffman St.97124 Hillsboro,/usa/oregon/portland/flexential-hillsboro2/
Oregon,Portland,Flexential Portland - Hillsboro 1 Data Center,Flexential3935 NE Aloclek Place97124 Hillsboro,/usa/oregon/portland/flexential-hillsboro/
Oregon,Portland,Flexential Portland - Hillsboro 5 Data Center,Flexential4975 NE Starr Blvd97124 Hillsboro,/usa/oregon/portland/flexential-hillsboro5/
Oregon,Portland,Flexential Portland - Hillsboro 4 Data Center,Flexential4915 NE Starr Blvd97124 Hillsboro,/usa/oregon/portland/flexential-hillsboro4/
Oregon,Portland,6675 NE 62nd Ave (PDX11),Digital Realty6675 NE 62nd Ave97124 Hillsboro,/usa/oregon/portland/6675-ne-62nd/
Oregon,Portland,NTT Hillsboro HI1,NTT Global Data Centers4050 NE Evergreen Road97124 Hillsboro,/usa/oregon/portland/ntt-hillsboro-hi1/
Oregon,Portland,H5 Data Centers Portland,H5 Data Centers1233 NW 12th Ave97209 Portland,/usa/oregon/portland/h5-portland/
Oregon,Portland,Digital Fortress - PTL2,Digital Fortress9705 SW Sunshine Court97005 Beaverton,/usa/oregon/portland/easystreet-online-services/
Oregon,Portland,EdgeConneX Portland - EDCPOR01,EdgeConneX6327 NW Evergreen Pkwy97124 Hillsboro,/usa/oregon/portland/edcpor01/
Oregon,Portland,STACK Infrastructure POR02A,STACK INFRASTRUCTURE21515 NW Evergreen Parkway97124 Hillsboro,/usa/oregon/portland/fortune-oregon/
Oregon,Portland,Pittock Block,1547 Critical Systems Realty921 SW Washington St97205 Portland,/usa/oregon/portland/pittock-ix/
Oregon,Portland,EdgeConneX Portland - EDCPOR02,EdgeConneX6297 NE Evergreen Pkwy97124 Hillsboro,/usa/oregon/portland/edgeconnex-por02/
Oregon,Portland,QTS Hillsboro DC 1,QTS Data Centers4951 NE Huffman Street97124 Hillsboro,/usa/oregon/portland/qts-hillsboro/
Oregon,Portland,Hillsboro Datacenter,Opus Interactive8135 NE Evergreen Parkway97124 Hillsboro,/usa/oregon/portland/hillsboro-datacenter/
Oregon,Portland,DTS-NET Colocation & Hosting,DTS-NETSW Stark Street97205 Portland,/usa/oregon/portland/lightpoint-colocation/
Oregon,Portland,Digital Fortress - PTL,Digital Fortress511 SW 10th Ave.97205 Portland,/usa/oregon/portland/infinity-internet/
Oregon,Portland,Digital Fortress - PTL3,Digital Fortress9610 SW Sunshine Ct97005 Beaverton,/usa/oregon/portland/atmosera2/
Oregon,Portland,Lumen Cedar Hills,Lumen14197 SW Millikan Way97005 Cedar Hills,/usa/oregon/portland/twtc-cedar-hills/
Oregon,Portland,"Opus Interactive - Portland, Oregon",Opus Interactive1225 W Burnside Street97209 Portland,/usa/oregon/portland/opus-portland/
Oregon,Portland,Lumen Portland 1,Lumen1335 NEW Northrup Street97209 Portland,/usa/oregon/portland/level3-portland1/
Oregon,Portland,Lumen Portland 2,Lumen707 SW Washington Avenue97205 Portland,/usa/oregon/portland/level3-portland2/
Oregon,Portland,DirectSpace Networks,DirectSpace Networks707 SW Washington St97205 Portland,/usa/oregon/portland/dsone/
Oregon,Portland,Weberz Hosting,Weberz Hosting22414 N.E. Townsend Way97024 Fairview,/usa/oregon/portland/weberz-hosting/
Oregon,Portland,XO Portland,XO Communications10575 SW Cascade Ave97223 Tigard,/usa/oregon/portland/xo-portland1/
Oregon,Portland,XO Portland #2,XO Communications9000 SW Nimbus Ave97008 Beaverton,/usa/oregon/portland/xo-portland2/
Oregon,Portland,Tata Communications Hillsboro,Tata Communications21101 NW Evergreen Parkway97124 Hillsboro,/usa/oregon/portland/tata-hillsboro/
Oregon,Portland,tw telecom Portland,tw telecom520 SW 6th Ave97204 Portland,/usa/oregon/portland/twtc-portland/
Oregon,Medford,Data Center West,"Data Center West, Inc739 Welch Drive97501 Medford",/usa/oregon/medford/data-center-west/
Oregon,Eugene,Lumen Eugene 2,Lumen90470 Prairie Rd97402 Eugene,/usa/oregon/eugene/lumen-eugene/
Oregon,Eugene,Lumen Eugene 1,Lumen1745 W. 5th Avenue97402 Eugene,/usa/oregon/eugene/level3-eugene1/
Oregon,Bend,OneNeck Bend,OneNeck IT Solutions20845 Sockeye Pl97701 Bend,/usa/oregon/bend/oneneck-bend/
Oregon,Bend,Columbia 1,Cascade Divide207 SW Columbia St97702 Bend,/usa/oregon/bend/columbia1/
Oregon,Hillsboro,5870 NE Schaaf Street (PDX12),Digital Realty5870 NE Schaaf Street97124 Hillsboro,/usa/oregon/hillsboro/5870-ne-schaaf/
Oregon,Hillsboro,STACK Infrastructure POR03B,STACK INFRASTRUCTURE4735 NE Starr Blvd97124 Hillsboro,/usa/oregon/hillsboro/stack-infrastructure-por03b/
Oregon,Hillsboro,Aligned PDX-01,Aligned Data CentersNE 30th Ave & NE Evergreen Rd97124 Hillsboro,/usa/oregon/hillsboro/aligned-pdx-01/
Oregon,Hillsboro,Aligned PDX-02,Aligned Data CentersNE 30th Ave & NE Evergreen Rd97124 Hillsboro,/usa/oregon/hillsboro/aligned-pdx-02/
Oregon,Hillsboro,Hillsboro Campus,Aligned Data CentersNE 30th Ave & NE Evergreen Rd97124 Hillsboro,/usa/oregon/hillsboro/hillsboro-campus/
Oregon,Hillsboro,STACK Infrastructure POR01,STACK INFRASTRUCTURE3145 NE Brookwood Pkwy97124 Hillsboro,/usa/oregon/hillsboro/stack-infrastructure-por01/
Oregon,Hillsboro,QTS Hillsboro 2 Campus,QTS Data Centers4755 NE Huffman Street97124 Hillsboro,/usa/oregon/hillsboro/qts-hillsboro2-campus/
Oregon,Baker City,Synergy Data Center & Services,Synergy Data Center & Services1650 Dewey Ave97814 Baker City,/usa/oregon/baker-city/synergy-data-center--services/
Oregon,Corvallis,Kattare CVO,Kattare Inc.5010 SW HOUT ST97333 Corvallis,/usa/oregon/corvallis/kattare-cvo/
Oregon,Bandon,Lumen Bandon,Lumen96614 Wickizer Way97411 Bandon,/usa/oregon/bandon/level3-bandon/
Oregon,Prineville,Meta Prineville Data Center,META735 SW Connect Way97754 Prineville,/usa/oregon/prineville/meta-prineville-data-center/
Oregon,The Dalles,Google The Dalles Data Center,Google4200 Columbia Rd97058 The Dalles,/usa/oregon/the-dalles/google-the-dalles/
Oregon,Umatilla,SDC Umatilla,Sabey Data Center Properties LLCBeach Access Road97882 Umatilla,/usa/oregon/umatilla/sdc-umatilla/
Florida,Tampa,Hivelocity - Tampa 2,Hivelocity5908 Hampton Oaks Parkway33610 Tampa,/usa/florida/tampa/hivelocity-tpa2/
Florida,Tampa,Hivelocity - Tampa 1,Hivelocity8010 Woodland Center Blvd.33614 Tampa,/usa/florida/tampa/hivelocity/
Florida,Tampa,Flexential Tampa - West Data Center,Flexential9417 Corporate Lake Drive33634 Tampa,/usa/florida/tampa/flexential-tampa-west/
Florida,Tampa,Cologix LAK1,Cologix2850 Interstate Drive33805 Lakeland,/usa/florida/tampa/cologix-lakeland/
Florida,Tampa,Flexential Tampa - North Data Center,Flexential8350 Parkedge Drive33637 Tampa,/usa/florida/tampa/flexential-tampa/
Florida,Tampa,Centersquare - Tampa TPA1,Centersquare9310 Florida Palm Dr.33619 Tampa,/usa/florida/tampa/cyxtera-tpa1/
Florida,Tampa,E Solutions,WOW Business/E Solutions400 North Tampa Street33602 Tampa,/usa/florida/tampa/e-solutions-corporation/
Florida,Tampa,Datatech Hosting Tampa,Data-Tech7904 Hopi Place33634 Tampa,/usa/florida/tampa/datatech-hosting/
Florida,Tampa,365 Data Centers - Tampa,365 Data Centers655 N Franklin St.33602 Tampa,/usa/florida/tampa/switchdata-tampa/
Florida,Tampa,Lumen Tampa 1,Lumen7909 Woodland Center Blvd33614 Tampa,/usa/florida/tampa/level3-tampa/
Florida,Tampa,OneColo,OneColo610 N Morgan St33602 Tampa,/usa/florida/tampa/onecolo/
Florida,Tampa,Lumen Tampa 3,Lumen1700 N 25th Street33605 Tampa,/usa/florida/tampa/level3-tampa3/
Florida,Tampa,Lumen Tampa 4,Lumen400 North Tampa Street33602 Tampa,/usa/florida/tampa/twtc-tampa/
Florida,Tampa,Lumen Tampa 2,Lumen59007 Hampton Oaks Parkway33610 Tampa,/usa/florida/tampa/level3-tampa2/
Florida,Tampa,Tampa Enterprise Data Center,Tampa Enterprise Data Center1309 North Ward St.33607 Tampa,/usa/florida/tampa/tampa-enterprise-dc/
Florida,Tampa,Hostway Tampa,"Hostway Services, Inc412 East Madison Avenue33602 Tampa",/usa/florida/tampa/hostway-tampa/
Florida,Tampa,Cogent Tampa,"Cogent Communications, Inc.400 N Tampa St33602 Tampa",/usa/florida/tampa/cogent-tampa/
Florida,Tampa,IT Support Guys - Tampa,IT Support Guys2709 N Rocky Point Dr33607 Tampa,/usa/florida/tampa/itsupportguys-tampa/
Florida,Tampa,Hostway Tampa Franklin,"Hostway Services, Inc655 N Franklin St33602 Tampa",/usa/florida/tampa/hostway-tampa-franklin/
Florida,Tampa,Synergy ISP,Synergy ISP4465 West Gandy33611 Tampa,/usa/florida/tampa/synergy-isp/
Florida,Tampa,Acehost Tampa,Acehost203 Marion St33602 Tampa,/usa/florida/tampa/acehost-tampa/
Florida,Tampa,Park Tower,Sterling American Property Inc400 North Tampa Street33602 Tampa,/usa/florida/tampa/park-tower/
Florida,Tampa,655 North Franklin,The Wilson Company655 North Franklin Street33602 Tampa,/usa/florida/tampa/655-north-franklin/
Florida,Tampa,XO Tampa,XO Communications5904-A Hampton Oaks Pkwy33610 Tampa,/usa/florida/tampa/xo-tampa/
Florida,Tampa,Acehost.com,Acehost412 E Madison St suite 101033602 Tampa,/usa/florida/tampa/acehostcom/
Florida,Miami,36 NE 2nd St (MIA10),Digital Realty36 NE 2nd Street33132 Miami,/usa/florida/miami/36ne-2nd-street/
Florida,Miami,Hivelocity - Miami 1,Hivelocity50 NE 9th St33132 Miami,/usa/florida/miami/hivelocity-miami-1/
Florida,Miami,2300 NW 89th Pl (MIA11),Digital Realty2300 NW 89th Pl33172 Miami,/usa/florida/miami/2300nw-89th-pl/
Florida,Miami,Equinix MI1 (NAP of the Americas),Equinix50 NE 9th Street33132 Miami,/usa/florida/miami/terremark-miami/
Florida,Miami,CoreSite Miami (MI1),CoreSite2115 NW 22nd Street33142 Miami,/usa/florida/miami/miami-exchange/
Florida,Miami,ColoHouse Miami,ColoHouse36 NE 2nd Street33132 Miami,/usa/florida/miami/colohouse/
Florida,Miami,KeyCenter,TELEFONICA US11300 NW 25th Street33172 Miami,/usa/florida/miami/telefonica-keycenter/
Florida,Miami,Volico Miami 2,Volico Data Center36 NE 2nd St33132 Miami,/usa/florida/miami/volico-data-center/
Florida,Miami,QTS Miami,QTS Data Centers11234 NW 20th St.33172 Miami,/usa/florida/miami/quality-miami-data-center/
Florida,Miami,MIA2,Raeden200 SE 1st St33131 Miami,/usa/florida/miami/mia2/
Florida,Miami,EdgeConneX Miami - EDCMIA02,EdgeConneX475 NE 185th St.33179 Miami Gardens,/usa/florida/miami/edgeconnex-edcmia02/
Florida,Miami,DataBank MIA1 - Downtown Miami,DataBank36 NE 2nd St33132 Miami,/usa/florida/miami/zcolo-36ne-2nd/
Florida,Miami,EdgeConneX Miami - EDCMIA01,EdgeConneX2132 NW 114th Ave33172 Miami,/usa/florida/miami/edcmia01/
Florida,Miami,Colocation America MiamiDC1,Colocation America36 NE 2nd St33132 Miami,/usa/florida/miami/colocation-america-miamidc1/
Florida,Miami,Volico Miami 1,Volico Data Center100N Biscayne Blvd33137 Miami,/usa/florida/miami/volico-miami-1/
Florida,Miami,Equinix MI6,"Equinix1525 NW 98th Court, International Corporate Park33172 Doral",/usa/florida/miami/equinix-mi6/
Florida,Miami,Key Center,Nabiax11300 NW 25th Street33172 Miami,/usa/florida/miami/nabiax-key-center/
Florida,Miami,IPXON Miami,IPXON Networks50 NE 9th St33132 Miami,/usa/florida/miami/ipxon-miami/
Florida,Miami,Equinix MI2,Equinix36 Northeast Second Street33132 Miami,/usa/florida/miami/switchdata-miami-36ne/
Florida,Miami,Lumen Miami 4,Lumen50 NE 9th St33132 Miami,/usa/florida/miami/lumen-miami-4/
Florida,Miami,Lumen Miami 5,Lumen1109 NW 22nd St33127 Miami,/usa/florida/miami/lumen-miami-5/
Florida,Miami,Aptum Miami,Aptum2300 NW 89th Pl33172 Miami,/usa/florida/miami/peer-1-miami/
Florida,Miami,NocRoom Miami Colocation and VPS,NocRoom Miami Colocation VPS36 NE 2nd Street33132 Miami,/usa/florida/miami/switchmia/
Florida,Miami,Navegalo Miami Data Center,Navegalo36 NE 2nd Street33132 Miami,/usa/florida/miami/rack-lodge-miami/
Florida,Miami,Lumen Miami 3,Lumen200 SE First Street33131 Miami,/usa/florida/miami/level3-miami3/
Florida,Miami,Lumen Miami,Lumen49 N.W. 5th Street33128 Miami,/usa/florida/miami/level3-miami/
Florida,Miami,Cogent Miami,"Cogent Communications, Inc.200 SE 1st St33131 Miami",/usa/florida/miami/cogent-miami/
Florida,Miami,Net Data,Nettalk .Com Inc.1080 NW 163rd Drive33169 Miami,/usa/florida/miami/net-data/
Florida,Miami,Miami-Connect,"Miami-Connect, LLC100 N.Biscayne Blvd.33132 Miami",/usa/florida/miami/nwt-data-center/
Florida,Miami,Interconnect Miami,Interconnect Miami36 NE 2nd Street33132 Miami,/usa/florida/miami/interconnect-miami/
Florida,Miami,Digiport DataCenter,Digiport200 SE 1st Street33131 Miami,/usa/florida/miami/digiport-datacenter/
Florida,Miami,Cogent Miami 2,"Cogent Communications, Inc.3701 NW 82nd Street33166 Doral",/usa/florida/miami/cogent-miami2/
Florida,Miami,Dedicated Server Store,Stealth - ISS Inc.1953 NW 22nd Street33142 Miami,/usa/florida/miami/stealth-iss-data-center/
Florida,Miami,Nettogo,Nettogo11560 SW 120 St33176 Miami,/usa/florida/miami/nettogo/
Florida,Miami,East1,Open Hosting36 NE 2nd Street33132 Miami,/usa/florida/miami/east1/
Florida,Miami,BurstNET - Miami DC1,BurstNET200 SE 1ST ST33131 Miami,/usa/florida/miami/burstnet-miami-dc1/
Florida,Miami,Virtual Servers Data Center,Virtual Servers Data Center1100 NW 163rd Drive33169 Miami,/usa/florida/miami/carrierhouse-data-center/
Florida,Miami,Miami Data Vault,Miami Data Vault100 NE 80th Terrace33138 Miami,/usa/florida/miami/miami-data-vault/
Florida,Miami,200 Technology Center,Unknown Company200 SE 1st Street33131 Miami,/usa/florida/miami/200-technology-center/
Florida,Miami,XO Miami,XO Communications16563 NW 15th Ave33169 Miami,/usa/florida/miami/xo-miami/
Florida,Miami,Volico,"Biznesshosting, Inc.200 SE 1st St33131 Miami",/usa/florida/miami/volico/
Florida,Orlando,HostDime Orlando,HostDime Global Corp440 West Kennedy Blvd32810 Orlando,/usa/florida/orlando/hostdime/
Florida,Orlando,CoreSite Orlando (OR1),CoreSite9701 S. John Young Parkway32819 Orlando,/usa/florida/orlando/coresite-or1/
Florida,Orlando,ndtHOST,ndtHOST8635 Holiday Springs Rd.32940 Melbourne,/usa/florida/orlando/ndthost/
Florida,Orlando,200 Avenue B NW,DSM Technology Consultants200 Avenue B NW33881 Winter Haven,/usa/florida/orlando/200-avenue-b-nw/
Florida,Orlando,Lumen Orlando,Lumen380 South Lakew Destiny Drive32810 Orlando,/usa/florida/orlando/level3-orlando/
Florida,Orlando,Signal Hill Telecom Center,"SH OTC, LLC440 W. Kennedy Blvd32810 Orlando",/usa/florida/orlando/signal-hill-telecom/
Florida,Orlando,Lumen Orlando 2,Lumen510 W. Columbia Street32805 Orlando,/usa/florida/orlando/level3-orlando2/
Florida,Orlando,Lumen Orlando 3,Lumen7003 Presidents Dr32809 Oak Ridge,/usa/florida/orlando/twtc-orlando/
Florida,Orlando,Corserva Orlando,Corserva8251 Presidents Drive32809 Orlando,/usa/florida/orlando/pcnet-orlando/
Florida,Orlando,Atlantic.Net,Atlantic.Net440 West Kennedy Blvd32810 Orlando,/usa/florida/orlando/atlantic-orlando/
Florida,Orlando,Smart City,"Smart City Holdings, LLC1101 N. Keller Road32810 Orlando",/usa/florida/orlando/smart-city/
Florida,Orlando,Colo Solutions Orlando,Colo Solutions100 West Lucerne Circle32801 Orlando,/usa/florida/orlando/colo-solutions-orlando/
Florida,Winter Haven,DSM Myfloridacloud.com Data Center,DSM Technology Consultants200 Avenue B NW33881 Winter Haven,/usa/florida/winter-haven/dsm-myfloridacloud/
Florida,Winter Haven,Inland Fiber & Data,"Inland Fiber & Data199 Ave B, NW33881 Winter Haven",/usa/florida/winter-haven/inland/
Florida,Boca Raton,Volico Fort Lauderdale,Volico Data Center500 Green Rd33064 Pompano,/usa/florida/boca-raton/volico-2/
Florida,Boca Raton,Equinix  MI3,Equinix4680 Conference Way South33431 Boca Raton,/usa/florida/boca-raton/equinix--mi3/
Florida,Boca Raton,365 Data Centers-Boca Raton-Ph. 3&4,"365 Data Centers3500 NW Boca Raton Blvd, Bldg 80033431 Boca Raton",/usa/florida/boca-raton/hostnet-phase-iii--iv/
Florida,Boca Raton,365 Data Centers-Boca Raton-Phase 2,"365 Data Centers3500 NW Boca Raton Blvd, Bldg 90033431 Boca Raton",/usa/florida/boca-raton/host-net/
Florida,Boca Raton,Cogent Boca Raton,"Cogent Communications, Inc.5050 Conference Way North33431 Boca Raton",/usa/florida/boca-raton/cogent-boca-raton/
Florida,Boca Raton,Real Effects Boca Raton,"Real Effects Internet Group3500 NW 2nd Ave, Bldg 90433431 Boca Raton",/usa/florida/boca-raton/real-effects-colo/
Florida,Boca Raton,Axios Hosting,Axios Hosting5000 T-Rex Ave.33431 Boca Raton,/usa/florida/boca-raton/axios-hosting/
Florida,Boca Raton,3500 NW,Unknown Company3500 NW 2nd Ave33431 Boca Raton,/usa/florida/boca-raton/3500-nw/
Florida,Fort Lauderdale,Flexential Fort Lauderdale Data Center,Flexential5301 NW 33rd Ave33309 Fort Lauderdale,/usa/florida/fort-lauderdale/flexential-fort-lauderdale/
Florida,Fort Lauderdale,365 Data Centers - Fort Lauderdale,365 Data Centers3250 W Commercial Blvd33309 Fort Lauderdale,/usa/florida/fort-lauderdale/hostnet-fort-lauderdale/
Florida,Fort Lauderdale,Volico Deerfield,Volico Data Center500 NW 48 Street33064 Pompano Beach,/usa/florida/fort-lauderdale/volico-deerfield/
Florida,Fort Lauderdale,Lumen Fort Lauderdale 1,Lumen200 NW 2nd Street33311 Fort Lauderdale,/usa/florida/fort-lauderdale/level3-fort-lauderdale1/
Florida,Fort Lauderdale,HostOKAY Web Hosting,"WebHostingValley7120 North Nob Hill Road, Pompano Beach33321 Tamarac",/usa/florida/fort-lauderdale/hostokay-web-hosting/
Florida,Fort Lauderdale,ARK Data Center,CIN- ARK Data Center600 SW 3rd Street33060 Pompano Beach,/usa/florida/fort-lauderdale/ark-data-center/
Florida,Fort Lauderdale,tw telecom Fort Lauderdale,tw telecom100 Ne 3rd Ave33301 Fort Lauderdale,/usa/florida/fort-lauderdale/twtc-fort-lauderdale/
Florida,West Palm Beach,Cloud South,Cloud South424 Hampton Road33405 West Palm Beach,/usa/florida/west-palm-beach/cloud-south/
Florida,West Palm Beach,Lumen West Palm Beach 1,"Lumen410 Hampton Road,33405 West Palm Beach",/usa/florida/west-palm-beach/level3-west-palm-beach1/
Florida,Gainesville,Gainesville Data Center,Acceleration2511 NW 41st Street32606 Gainesville,/usa/florida/gainesville/gainesville-data-center/
Florida,Jacksonville,Cologix JAX1,Cologix421 West Church Street32202 Jacksonville,/usa/florida/jacksonville/421-west-church-street/
Florida,Jacksonville,Cologix JAX2,Cologix4800 Spring Park Road32207 Jacksonville,/usa/florida/jacksonville/cologix-jax2/
Florida,Jacksonville,Flexential Jacksonville Data Center,Flexential4905 Belfort Road32256 Jacksonville,/usa/florida/jacksonville/flexential-jacksonville/
Florida,Jacksonville,TierPoint Jacksonville,TierPoint8324 Baymeadows Way32256 Jacksonville,/usa/florida/jacksonville/tierpoint-florida/
Florida,Jacksonville,EdgeConneX Jacksonville - EDCJAX01,"EdgeConneX6602 Executive Park Ct N, Unit #105.32216 Jacksonville",/usa/florida/jacksonville/edcjax01/
Florida,Jacksonville,SBA Edge JaxNAP,SBA Edge421 West Church Street32202 Jacksonville,/usa/florida/jacksonville/jax/
Florida,Jacksonville,GoRACK Data Center,GoRACK Data Center800 Water Street32204 Jacksonville,/usa/florida/jacksonville/gorack-data-center/
Florida,Jacksonville,Lumen Jacksonville 2,Lumen608 W. Adams Street32204 Jacksonville,/usa/florida/jacksonville/level3-jacksonville2/
Florida,Jacksonville,Lumen Jacksonville 1,Lumen4814 Phillips Highway32207 Jacksonville,/usa/florida/jacksonville/level3-jacksonbille1/
Florida,Jacksonville,Lumen Jacksonville,Lumen608 W. Adams Street32204 Jacksonville,/usa/florida/jacksonville/level3-jacksonville/
Florida,Jacksonville,CSX Data Center,ColoCSX6425 Southpoint Parkway32216 Jacksonville,/usa/florida/jacksonville/csx-data-center/
Florida,Jacksonville,Edge Data Center - Jacksonville,American Tower Corporation325 17th Avenue North32250 Jacksonville Beach,/usa/florida/jacksonville/jacksonville-edge/
Florida,Jacksonville,GoRACK 421,"GoRACK Data Center421 West Church Street, STE 11132202 Jacksonville",/usa/florida/jacksonville/gorack-421/
Florida,Jacksonville,Windstream Jacksonville,Windstream421 W. Church St.32202 Jacksonville,/usa/florida/jacksonville/windstream-jacksonville/
Florida,Jacksonville,tw telecom Jacksonville,tw telecom200 W Forsyth St32202 Jacksonville,/usa/florida/jacksonville/twtc-jacksonville/
Florida,Tallahassee,EdgeConneX Tallahassee-EDCTAL01,"EdgeConneX1531 Commonwealth Business Dr, Units 404-40832303 Tallahassee",/usa/florida/tallahassee/edgeconnex-edctal01/
Florida,Tallahassee,Lumen Tallahassee,Lumen619 Mabry Street32304 Tallahassee,/usa/florida/tallahassee/level3-tallahassee/
